{
  "id": "memory.fixture.preference",
  "protocol": "AI-CONTEXT/MEMORY",
  "schema_version": "0.1.0",
  "record_type": "preference",
  "content": {"editor": "vim"},
  "sensitivity": "private",
  "epistemic_state": "user_asserted",
  "confidence": 1.0,
  "approval": "approved",
  "source_refs": [],
  "tags": ["coding"],
  "lifecycle": {"state": "active", "expires_at": null, "supersedes": null},
  "created_at": "2026-08-23T00:00:00Z",
  "last_verified": null,
  "notes": "synthetic conformance fixture"
}
